{
  "$schema": "https://events.fogrugby.com/events.schema.json",
  "version": "1.0.0",
  "calendar_name": "SF Fog Rugby",
  "calendar_url": "https://www.fogrugby.com/season-fixtures-results",
  "feed_url": "https://events.fogrugby.com/events.json",
  "ics_url": "https://events.fogrugby.com/fog.ics",
  "schema_org_url": "https://events.fogrugby.com/schema-events.jsonld",
  "openapi_url": "https://events.fogrugby.com/openapi.yaml",
  "timezone": "America/Los_Angeles",
  "updated_at": "2026-11-01T13:30:47Z",
  "total_events": 45,
  "events": [
    {
      "id": "2026-09-11-memorial-toast",
      "uid": "2026-09-11-memorial-toast@fogrugby.com",
      "title": "Fog 9/11 Memorial Toast — Pilsner Inn",
      "category": "social",
      "status": "confirmed",
      "all_day": false,
      "start": "2026-09-11T19:00:00-07:00",
      "end": "2026-09-11T23:00:00-07:00",
      "date": "2026-09-11",
      "time": "19:00",
      "end_time": "23:00",
      "location": "Pilsner Inn, 225 Church St, San Francisco",
      "notes": "Doors 7pm. Toast at 8pm in memory of Mark Bingham, those lost on 9/11, and departed Fog alumni. Players, supporters and friends welcome.",
      "url": null,
      "image": "https://events.fogrugby.com/assets/img/fog-coat-of-arms.png",
      "rrule": null,
      "exdates": []
    },
    {
      "id": "2026-09-13-drop-in-touch-st-marys-optional",
      "uid": "2026-09-13-drop-in-touch-st-marys-optional@fogrugby.com",
      "title": "Sunday Drop-In Touch (SF Vintage) [Optional]",
      "category": "social",
      "status": "confirmed",
      "all_day": false,
      "start": "2026-09-13T09:00:00-07:00",
      "end": "2026-09-13T11:00:00-07:00",
      "date": "2026-09-13",
      "time": "09:00",
      "end_time": "11:00",
      "location": "St Mary's Rec Center, 95 Justin Drive, San Francisco, CA 94112",
      "notes": "Cost: Free!\n\nWho Can Play:\n - Open to all ages, genders, orientations, and skill levels.\n - Completely beginner-friendly—no prior experience necessary.\n\nWhat to Bring:\n - Cleats or athletic shoes.\n - A blue or red shirt.\n\nWebsite: sfvrfc.org\nFacebook: https://www.facebook.com/groups/139383596170951/\nMap: https://maps.app.goo.gl/D8iDm2Q5WLorWvwK7",
      "url": "https://chat.whatsapp.com/Hou5lyxuAIRLQS6Pfne2Bt?mode=wwt",
      "image": "https://events.fogrugby.com/assets/img/fog-coat-of-arms.png",
      "rrule": "FREQ=WEEKLY;BYDAY=SU;UNTIL=20270530T180000Z",
      "exdates": [
        "2026-12-06",
        "2027-05-30"
      ]
    },
    {
      "id": "2026-09-13-kangaroo-court-beach-bash",
      "uid": "2026-09-13-kangaroo-court-beach-bash@fogrugby.com",
      "title": "Kangaroo Court and Beach Bash",
      "category": "social",
      "status": "confirmed",
      "all_day": false,
      "start": "2026-09-13T15:00:00-07:00",
      "end": "2026-09-13T19:00:00-07:00",
      "date": "2026-09-13",
      "time": "15:00",
      "end_time": "19:00",
      "location": "Ocean Beach, San Francisco",
      "notes": "Beach touch and potluck at Ocean Beach, then Kangaroo Court sits. RSVP on Partiful.",
      "url": "https://partiful.com/e/ANPVBHCNveMygh8Ws3mX?c=Byz1a63E",
      "image": "https://events.fogrugby.com/assets/img/fog-coat-of-arms.png",
      "rrule": null,
      "exdates": []
    },
    {
      "id": "2026-09-26-magnitude-coat-check",
      "uid": "2026-09-26-magnitude-coat-check@fogrugby.com",
      "title": "Magnitude Coat Check (volunteers)",
      "category": "community",
      "status": "confirmed",
      "all_day": false,
      "start": "2026-09-26T20:00:00-07:00",
      "end": "2026-09-27T04:00:00-07:00",
      "date": "2026-09-26",
      "time": "20:00",
      "end_time": "04:00",
      "location": "SVN West, 10 Van Ness Ave, San Francisco",
      "notes": "The Fog runs the coat check at Magnitude, the Saturday night main event of Folsom Street Fair. Shifts run from 8pm to 4am; every tip goes to the club. 21+. Volunteer: fundraising@fogrugby.com",
      "url": "https://www.eventbrite.com/e/magnitude-2026-the-saturday-night-main-event-of-folsom-street-fairtm-tickets-1894668557659",
      "image": "https://events.fogrugby.com/assets/img/fog-coat-of-arms.png",
      "rrule": null,
      "exdates": []
    },
    {
      "id": "2026-09-27-folsom-sunscreen-booth",
      "uid": "2026-09-27-folsom-sunscreen-booth@fogrugby.com",
      "title": "Folsom Street Fair Sunscreen Booth (volunteers)",
      "category": "community",
      "status": "confirmed",
      "all_day": false,
      "start": "2026-09-27T10:00:00-07:00",
      "end": "2026-09-27T19:00:00-07:00",
      "date": "2026-09-27",
      "time": "10:00",
      "end_time": "19:00",
      "location": "Folsom Street Fair, San Francisco",
      "notes": "Sunscreen on strangers, talk rugby, hand out Pathway to Rugby flyers. Shifts between 10am and 7pm. Volunteer: fundraising@fogrugby.com",
      "url": null,
      "image": "https://events.fogrugby.com/assets/img/fog-coat-of-arms.png",
      "rrule": null,
      "exdates": []
    },
    {
      "id": "2026-10-06-pathways-1",
      "uid": "2026-10-06-pathways-1@fogrugby.com",
      "title": "Pathway to Rugby — Session 1",
      "category": "pathway",
      "status": "confirmed",
      "all_day": false,
      "start": "2026-10-06T19:30:00-07:00",
      "end": "2026-10-06T22:00:00-07:00",
      "date": "2026-10-06",
      "time": "19:30",
      "end_time": "22:00",
      "location": "Raymond Kimbell Playground Park, 1901 Geary Blvd, San Francisco, CA 94115",
      "notes": "Check-in from 7:30pm; session until 10pm. First sessions are free — bring boots or runners, water, and a mouthguard if you have one.",
      "url": "https://www.fogrugby.com/p2r",
      "image": "https://events.fogrugby.com/assets/img/pathway-to-rugby-flyer.jpg",
      "rrule": null,
      "exdates": []
    },
    {
      "id": "2026-10-08-pathways-2",
      "uid": "2026-10-08-pathways-2@fogrugby.com",
      "title": "Pathway to Rugby — Session 2",
      "category": "pathway",
      "status": "confirmed",
      "all_day": false,
      "start": "2026-10-08T19:30:00-07:00",
      "end": "2026-10-08T22:00:00-07:00",
      "date": "2026-10-08",
      "time": "19:30",
      "end_time": "22:00",
      "location": "Crocker Amazon Soccer Fields, Moscow St & Italy Ave, San Francisco, CA 94112",
      "notes": "Check-in from 7:30pm; session until 10pm, then social at the Pilsner Inn afterwards.",
      "url": "https://www.fogrugby.com/p2r",
      "image": "https://events.fogrugby.com/assets/img/pathway-to-rugby-flyer.jpg",
      "rrule": null,
      "exdates": []
    },
    {
      "id": "2026-10-13-pathways-3",
      "uid": "2026-10-13-pathways-3@fogrugby.com",
      "title": "Pathway to Rugby — Session 3",
      "category": "pathway",
      "status": "confirmed",
      "all_day": false,
      "start": "2026-10-13T19:30:00-07:00",
      "end": "2026-10-13T22:00:00-07:00",
      "date": "2026-10-13",
      "time": "19:30",
      "end_time": "22:00",
      "location": "Raymond Kimbell Playground Park, 1901 Geary Blvd, San Francisco, CA 94115",
      "notes": null,
      "url": "https://www.fogrugby.com/p2r",
      "image": "https://events.fogrugby.com/assets/img/pathway-to-rugby-flyer.jpg",
      "rrule": null,
      "exdates": []
    },
    {
      "id": "2026-10-14-fog-turns-26",
      "uid": "2026-10-14-fog-turns-26@fogrugby.com",
      "title": "The Fog turns 26",
      "category": "community",
      "status": "confirmed",
      "all_day": true,
      "start": "2026-10-14",
      "end": "2026-10-14",
      "date": "2026-10-14",
      "time": null,
      "end_time": null,
      "location": "San Francisco",
      "notes": "Club anniversary. 26 years of inclusive rugby.",
      "url": null,
      "image": "https://events.fogrugby.com/assets/img/fog-coat-of-arms.png",
      "rrule": null,
      "exdates": []
    },
    {
      "id": "2026-10-15-pathways-4",
      "uid": "2026-10-15-pathways-4@fogrugby.com",
      "title": "Pathway to Rugby — Session 4",
      "category": "pathway",
      "status": "confirmed",
      "all_day": false,
      "start": "2026-10-15T19:30:00-07:00",
      "end": "2026-10-15T22:00:00-07:00",
      "date": "2026-10-15",
      "time": "19:30",
      "end_time": "22:00",
      "location": "Crocker Amazon Soccer Fields, Moscow St & Italy Ave, San Francisco, CA 94112",
      "notes": "Check-in from 7:30pm; session until 10pm, then social at the Pilsner Inn afterwards.",
      "url": "https://www.fogrugby.com/p2r",
      "image": "https://events.fogrugby.com/assets/img/pathway-to-rugby-flyer.jpg",
      "rrule": null,
      "exdates": []
    },
    {
      "id": "2026-10-18-eagle-beer-bust",
      "uid": "2026-10-18-eagle-beer-bust@fogrugby.com",
      "title": "Eagle Beer Bust (volunteers)",
      "category": "community",
      "status": "confirmed",
      "all_day": false,
      "start": "2026-10-18T15:00:00-07:00",
      "end": "2026-10-18T19:00:00-07:00",
      "date": "2026-10-18",
      "time": "15:00",
      "end_time": "19:00",
      "location": "SF Eagle, San Francisco",
      "notes": "Fog beer bust at the Eagle, 3–7pm. Volunteers needed: fundraising@fogrugby.com",
      "url": null,
      "image": "https://events.fogrugby.com/assets/img/fog-coat-of-arms.png",
      "rrule": null,
      "exdates": []
    },
    {
      "id": "2026-10-20-pathways-5",
      "uid": "2026-10-20-pathways-5@fogrugby.com",
      "title": "Pathway to Rugby — Session 5",
      "category": "pathway",
      "status": "confirmed",
      "all_day": false,
      "start": "2026-10-20T19:30:00-07:00",
      "end": "2026-10-20T22:00:00-07:00",
      "date": "2026-10-20",
      "time": "19:30",
      "end_time": "22:00",
      "location": "Raymond Kimbell Playground Park, 1901 Geary Blvd, San Francisco, CA 94115",
      "notes": null,
      "url": "https://www.fogrugby.com/p2r",
      "image": "https://events.fogrugby.com/assets/img/pathway-to-rugby-flyer.jpg",
      "rrule": null,
      "exdates": []
    },
    {